{
  "$schema": "./sugya.schema.json",
  "format": "derech-tevunos/sugya",
  "version": 1,
  "id": "pesachim-liquids",
  "title": "Uncleanness of liquids",
  "tractate": "Pesachim",
  "folio": "16a / 18b (Eng. col. 17b)",
  "discussedAt": "Derech Tevunos ch. 9, pp. 174-178",
  "party": "party-group",
  "collection": "ramchal",
  "about": [
    "Ramchal quotes both ends of this thread and labels them himself: the proof as `הוכחה` (Heb p173, Eng p174) and Rav Huna's reply as `סתירה` (Heb p177, Eng p178). That gives two attested labels and makes the passage usable as a test fixture.",
    "The columns disagree on the second citation: the Hebrew reads `פסחים יח ב` and the English reads \"Pesachim 17b\". Both are recorded rather than resolved."
  ],
  "units": [
    {
      "id": "eleazar",
      "speaker": "R. Eleazar",
      "he": "אין טמאה למשקין כל עקר",
      "en": "Liquids cannot become unclean at all according to Torah law.",
      "move": { "element": "statement", "subtype": "firsthand", "attested": true },
      "provenance": "asserted",
      "anatomy": [
        { "kind": "categorical", "basis": "marked", "note": "`כל עקר`: no uncleanness for liquids at all — the whole class, denied." }
      ]
    },
    {
      "id": "testimony",
      "speaker": "R. Eleazar",
      "he": "תדע, שהרי העיד יוסי בן יועזר איש צרידה על איל קמצא דכן ועל משקין בית מטבחיא דכן",
      "en": "Know this, for Yosi ben Yo'ezer of Zeredah testified that the ayil locust is clean and that the liquids of the Temple slaughterhouse are clean.",
      "move": { "element": "proof", "subtype": "demonstration", "target": "eleazar", "marker": "תדע, שהרי", "attested": true },
      "provenance": "tradition",
      "anatomy": [
        {
          "kind": "hypothetical-syllogism-tollens",
          "note": "If liquids could become unclean by Torah law, the liquids of the Temple slaughterhouse would be unclean; Yosi ben Yo'ezer testified they are clean; so they cannot."
        }
      ]
    },
    {
      "id": "ravpapa",
      "speaker": "Rav Papa",
      "he": "אפלו למאן דאמר טמאת משקין דאוריתא – משקי בית מטבחיא הלכתא גמירי לה",
      "en": "Even according to the one who holds that liquid uncleanness is Torah law, the liquids of the Temple slaughterhouse are a halachah handed down from Sinai.",
      "move": { "element": "contradiction", "subtype": "opposition", "target": "testimony", "attested": false },
      "provenance": "asserted",
      "anatomy": [
        {
          "kind": "differs-in-context",
          "note": "The testimony speaks of a special halachah handed down from Sinai, not of liquid uncleanness in general — a different respect, so it proves nothing about the general case."
        }
      ],
      "note": "Ramchal labels only Rav Huna's reply. `דחיה` is inferred here, on the rule at Heb p185 that a `דחיה` may land on a proof that was brought, not only on a statement."
    },
    {
      "id": "ravhuna",
      "speaker": "Rav Huna b. Rav Nassan",
      "he": "ואלא הא דאמר רבי אלעזר אין טמאה למשקין כל עקר … ואי הלכתא גמירי לה – מי גמרינן מנה",
      "en": "But R. Eleazar concluded that liquids have no uncleanness at all precisely from Yosi ben Yo'ezer's testimony. If that is a halachah from Sinai, could we derive anything from it?",
      "move": { "element": "contradiction", "subtype": "direct", "target": "ravpapa", "attested": true },
      "provenance": "derivation",
      "anatomy": [
        {
          "kind": "hypothetical-syllogism-tollens",
          "note": "If the Temple liquids were a halachah from Sinai, nothing could be derived from them; R. Eleazar did derive from them; so they are not. The same shape as the proof it defends."
        }
      ],
      "note": "Ramchal: `הנה כאן סתר שמועתו של רב פפא לחלוטין` — Rav Papa's statement is absolutely contradicted (Heb p177)."
    }
  ]
}
